UC1 CREATE DATABASE AddressBook in MYSQL

mysql> CREATE DATABASE address_book_service;
Query OK, 1 row affected (0.01 sec)

mysql> show databases;
+----------------------+
| Database             |
+----------------------+
| address_book_service |
| information_schema   |
| mysql                |
| payroll_service      |
| performance_schema   |
| sakila               |
| sys                  |
| world                |
+----------------------+
8 rows in set (0.01 sec)


UC2 CREATE TABLE addressbook

mysql> use address_book_services;
Database changed
mysql> Select Database();
+-----------------------+
| Database()            |
+-----------------------+
| address_book_services |
+-----------------------+
1 row in set (0.00 sec)

mysql> Create Table address_book
    -> (
    -> firstName VARCHAR(150) NOT NULL,
    -> lastName VARCHAR(150) NOT NULL,
    -> address VARCHAR(150) NOT NULL,
    -> city VARCHAR(150) NOT NULL,
    -> state VARCHAR(150) NOT NULL,
    -> zip VARCHAR(50) NOT NULL,
    -> phoneNumber VARCHAR(50) NOT NULL,
    -> email VARCHAR(150) NOT NULL);
Query OK, 0 rows affected (0.05 sec)

mysql> DESCRIBE address_book;
+-------------+--------------+------+-----+---------+-------+
| Field       | Type         | Null | Key | Default | Extra |
+-------------+--------------+------+-----+---------+-------+
| firstName   | varchar(150) | NO   |     | NULL    |       |
| lastName    | varchar(150) | NO   |     | NULL    |       |
| address     | varchar(150) | NO   |     | NULL    |       |
| city        | varchar(150) | NO   |     | NULL    |       |
| state       | varchar(150) | NO   |     | NULL    |       |
| zip         | varchar(50)  | NO   |     | NULL    |       |
| phoneNumber | varchar(50)  | NO   |     | NULL    |       |
| email       | varchar(150) | NO   |     | NULL    |       |
+-------------+--------------+------+-----+---------+-------+
8 rows in set (0.02 sec)

UC3 Insert new Contact to addressbook.

mysql> INSERT INTO address_book (firstName,LastName,address,city,state,zip,phoneNumber,email)VALUES
    -> ('Omkar','Mote','Pandare','Baramati','Maharashtra',412304,8756324185,'omkarm@gmail.com'),
    -> ('Prasad','Dhumal','Supe','Baramati','Maharashtra','412204','9922563547','prasadd@gmail.com');
Query OK, 2 rows affected (0.01 sec)
Records: 2  Duplicates: 0  Warnings: 0

mysql> INSERT INTO address_book (firstName,LastName,address,city,state,zip,phoneNumber,email)VALUES
    -> ('Arshjeet','Barkade','Supe','Baramati','Maharashtra','412204','7756096271','arshjeetb@gmail.com'),
    -> ('Abhishek','Deshmukh','Supe','Baramti','Maharashtra','412204','9822653415','abhideshmukh@gmail.com'),
    -> ('Darshan','Basale','Supe','Baramti','Maharashtra','412204','9985745142','darshanb@gmail.com');
Query OK, 3 rows affected (0.01 sec)
Records: 3  Duplicates: 0  Warnings: 0

mysql> SELECT * FROM address_book;
+-----------+----------+---------+----------+-------------+--------+-------------+------------------------+
| firstName | lastName | address | city     | state       | zip    | phoneNumber | email                  |
+-----------+----------+---------+----------+-------------+--------+-------------+------------------------+
| Omkar     | Mote     | Pandare | Baramati | Maharashtra | 412304 | 8756324185  | omkarm@gmail.com       |
| Prasad    | Dhumal   | Supe    | Baramati | Maharashtra | 412204 | 9922563547  | prasadd@gmail.com      |
| Arshjeet  | Barkade  | Supe    | Baramati | Maharashtra | 412204 | 7756096271  | arshjeetb@gmail.com    |
| Abhishek  | Deshmukh | Supe    | Baramti  | Maharashtra | 412204 | 9822653415  | abhideshmukh@gmail.com |
| Darshan   | Basale   | Supe    | Baramti  | Maharashtra | 412204 | 9985745142  | darshanb@gmail.com     |
+-----------+----------+---------+----------+-------------+--------+-------------+------------------------+
5 rows in set (0.00 sec)

UC4 Edit Contact to addressbook.

mysql> UPDATE address_book
    -> SET city = 'Pune',address='Kedgoan'
    -> WHERE firstName = 'Prasad';
Query OK, 1 row affected (0.01 sec)
Rows matched: 1  Changed: 1  Warnings: 0

mysql> SELECT * FROM address_book;
+-----------+----------+---------+----------+-------------+--------+-------------+------------------------+
| firstName | lastName | address | city     | state       | zip    | phoneNumber | email                  |
+-----------+----------+---------+----------+-------------+--------+-------------+------------------------+
| Omkar     | Mote     | Pandare | Baramati | Maharashtra | 412304 | 8756324185  | omkarm@gmail.com       |
| Prasad    | Dhumal   | Kedgoan | Pune     | Maharashtra | 412204 | 9922563547  | prasadd@gmail.com      |
| Arshjeet  | Barkade  | Supe    | Baramati | Maharashtra | 412204 | 7756096271  | arshjeetb@gmail.com    |
| Abhishek  | Deshmukh | Supe    | Baramti  | Maharashtra | 412204 | 9822653415  | abhideshmukh@gmail.com |
| Darshan   | Basale   | Supe    | Baramti  | Maharashtra | 412204 | 9985745142  | darshanb@gmail.com     |
+-----------+----------+---------+----------+-------------+--------+-------------+------------------------+
5 rows in set (0.00 sec)

UC5 Delete Contact from addressbook.

mysql> DELETE FROM address_book
    -> Where firstName = 'Darshan';
Query OK, 1 row affected (0.01 sec)

mysql> SELECT * FROM address_book;
+-----------+----------+---------+----------+-------------+--------+-------------+------------------------+
| firstName | lastName | address | city     | state       | zip    | phoneNumber | email                  |
+-----------+----------+---------+----------+-------------+--------+-------------+------------------------+
| Omkar     | Mote     | Pandare | Baramati | Maharashtra | 412304 | 8756324185  | omkarm@gmail.com       |
| Prasad    | Dhumal   | Kedgoan | Pune     | Maharashtra | 412204 | 9922563547  | prasadd@gmail.com      |
| Arshjeet  | Barkade  | Supe    | Baramati | Maharashtra | 412204 | 7756096271  | arshjeetb@gmail.com    |
| Abhishek  | Deshmukh | Supe    | Baramti  | Maharashtra | 412204 | 9822653415  | abhideshmukh@gmail.com |
+-----------+----------+---------+----------+-------------+--------+-------------+------------------------+
4 rows in set (0.00 sec)

UC6 Retrieve Person Belonging to a city or state form Addressbook.

mysql> SELECT * FROM address_book
    -> where city ='Pune';
+-----------+----------+---------+------+-------------+--------+-------------+-------------------+
| firstName | lastName | address | city | state       | zip    | phoneNumber | email             |
+-----------+----------+---------+------+-------------+--------+-------------+-------------------+
| Prasad    | Dhumal   | Kedgoan | Pune | Maharashtra | 412204 | 9922563547  | prasadd@gmail.com |
+-----------+----------+---------+------+-------------+--------+-------------+-------------------+
1 row in set (0.00 sec)

mysql> SELECT * FROM address_book
    -> where state = 'Maharashtra';
+-----------+----------+---------+----------+-------------+--------+-------------+------------------------+
| firstName | lastName | address | city     | state       | zip    | phoneNumber | email                  |
+-----------+----------+---------+----------+-------------+--------+-------------+------------------------+
| Omkar     | Mote     | Pandare | Baramati | Maharashtra | 412304 | 8756324185  | omkarm@gmail.com       |
| Prasad    | Dhumal   | Kedgoan | Pune     | Maharashtra | 412204 | 9922563547  | prasadd@gmail.com      |
| Arshjeet  | Barkade  | Supe    | Baramati | Maharashtra | 412204 | 7756096271  | arshjeetb@gmail.com    |
| Abhishek  | Deshmukh | Supe    | Baramti  | Maharashtra | 412204 | 9822653415  | abhideshmukh@gmail.com |
+-----------+----------+---------+----------+-------------+--------+-------------+------------------------+
4 rows in set (0.00 sec)

UC7 Size of addresbook by city or state.

mysql> Select count(state)
    -> From address_book;
+--------------+
| count(state) |
+--------------+
|            4 |
+--------------+
1 row in set (0.01 sec)

mysql> Select count(city)
    -> From address_book;
+-------------+
| count(city) |
+-------------+
|           4 |
+-------------+
1 row in set (0.00 sec)

UC8 Ability to retrieve entries sorted alphabetically by Person’s name for a given city.

mysql> use address_book_services;
Database changed
mysql> SELECT city FROM address_book ORDER BY firstname;
+----------+
| city     |
+----------+
| Baramti  |
| Baramati |
| Pune     |
| Baramati |
| Baramati |
| Pune     |
+----------+
6 rows in set (0.01 sec)

UC9 Ability to identify each Address Book with name and Type.

mysql> Alter Table address_book
    -> ADD name VARCHAR(150) AFTER lastName;
Query OK, 0 rows affected (0.10 sec)
Records: 0  Duplicates: 0  Warnings: 0

mysql> Alter Table address_book
    -> ADD type VARCHAR(150) AFTER name;
Query OK, 0 rows affected (0.11 sec)
Records: 0  Duplicates: 0  Warnings: 0

mysql> select * from address_book;
+-----------+----------+------+------+---------+----------+-------------+--------+-------------+------------------------+
| firstName | lastName | name | type | address | city     | state       | zip    | phoneNumber | email                  |
+-----------+----------+------+------+---------+----------+-------------+--------+-------------+------------------------+
| Omkar     | Mote     | NULL | NULL | Pandare | Baramati | Maharashtra | 412304 | 8756324185  | omkarm@gmail.com       |
| Prasad    | Dhumal   | NULL | NULL | Kedgoan | Pune     | Maharashtra | 412204 | 9922563547  | prasadd@gmail.com      |
| Arshjeet  | Barkade  | NULL | NULL | Supe    | Baramati | Maharashtra | 412204 | 7756096271  | arshjeetb@gmail.com    |
| Abhishek  | Deshmukh | NULL | NULL | Supe    | Baramti  | Maharashtra | 412204 | 9822653415  | abhideshmukh@gmail.com |
+-----------+----------+------+------+---------+----------+-------------+--------+-------------+------------------------+
4 rows in set (0.00 sec)

mysql> update address_book set name ='AddressBook1' WHERE firstname ='Arshjeet' or firstname ='Omkar';
Query OK, 2 rows affected (0.01 sec)
Rows matched: 2  Changed: 2  Warnings: 0

mysql> update address_book set name ='AddressBook2' WHERE firstname ='Abhishek';
Query OK, 1 row affected (0.01 sec)
Rows matched: 1  Changed: 1  Warnings: 0

mysql> update address_book set name ='AddressBook2' WHERE firstname ='Prasad';
Query OK, 1 row affected (0.01 sec)
Rows matched: 1  Changed: 1  Warnings: 0

mysql> update address_book set type ='Friends' WHERE firstname ='Arshjeet' or firstname ='Omkar';
Query OK, 2 rows affected (0.01 sec)
Rows matched: 2  Changed: 2  Warnings: 0

mysql> update address_book set type ='Family' WHERE firstname ='Abhishek' or firstname ='Prasad';
Query OK, 2 rows affected (0.01 sec)
Rows matched: 2  Changed: 2  Warnings: 0

mysql> select * from address_book;
+-----------+----------+--------------+---------+---------+----------+-------------+--------+-------------+------------------------+
| firstName | lastName | name         | type    | address | city     | state       | zip    | phoneNumber | email                  |
+-----------+----------+--------------+---------+---------+----------+-------------+--------+-------------+------------------------+
| Omkar     | Mote     | AddressBook1 | Friends | Pandare | Baramati | Maharashtra | 412304 | 8756324185  | omkarm@gmail.com       |
| Prasad    | Dhumal   | AddressBook2 | Family  | Kedgoan | Pune     | Maharashtra | 412204 | 9922563547  | prasadd@gmail.com      |
| Arshjeet  | Barkade  | AddressBook1 | Friends | Supe    | Baramati | Maharashtra | 412204 | 7756096271  | arshjeetb@gmail.com    |
| Abhishek  | Deshmukh | AddressBook2 | Family  | Supe    | Baramti  | Maharashtra | 412204 | 9822653415  | abhideshmukh@gmail.com |
+-----------+----------+--------------+---------+---------+----------+-------------+--------+-------------+------------------------+
4 rows in set (0.00 sec)